,customer_unique_id,segment,review_score,review_comment_title,review_comment_message
67996,5de99aeb246c239dfdb3db80bd8d8379,Potential Loyalist,1,Entrega pela metade,"Só foi entregue pelo correio o kit com as 3 mamadeiras, a saia do berço realeza não foi entregue até o momento. Já tive problema com este parceiro targaryen, nas compras que fiz pelas lojas lannister."
67861,ef88889c26945ab7901ad2b87fc26d6a,Potential Loyalist,1,Tecido muito fraco; ,"Comprei jogo cama casal em seda prata. A cor veio correta, contudo a confecção é de baixa categoria. Costuras soltas e esgaçadas; feito sem qualidade. Não recomendo ! Não compraria de novo. Péssima !"
67921,af5b766ebb8329a34871cbafc1e2352b,Potential Loyalist,1,Não recebi o produto,A previsão de entrega era para o dia 22/08 mas até agora não chegou.
68309,2b87779ed81054f89f79a85f4c56376b,Potential Loyalist,2,NÃO GOSTEI DA COR ,Não é da cor do anuncio. Ele é cor de rosa. Não gostei. 
68370,79093f1f5356ceced1473035e849be7c,Potential Loyalist,1,Produto não entregue ,"Comprei um bebedouro dia 08/04 e me deram um prazo de até o dia 30/04 para me entregar, hj já são 02/05 e não me entregaram não comprem nada vendido e entregue pela targaryen mando emails e não respondem"
68244,28f6c6914757a5933a8d48f60bd119f6,Potential Loyalist,1,crítica,as toalhas são ásperas e fininhas. Bela propaganda enganosa
68161,232108769b54310413984f29c3c8011a,Potential Loyalist,2,Gostei,"Recebi o produto certinho, mas quero o reembolso do frete pois eu paguei e tive que ir buscar no correio.
Gastei gasolina e ainda paguei o frete, sacanagem"
68176,5156800ff5ccf6659645449f961c4de0,Potential Loyalist,1,nao recomendo,mau atendimento. ate agora nao resolveram meu problema. 
40439,beb8aac45af8e0de5e4cd146432b9e84,Potential Loyalist,1,Não recomendo,Comprei 3 produtos dessa loja e só recebi um. Sendo que não tenho nem como rastrear onde foi parar meus 2 produtos porque colocaram que eu recebi. Vou ter que entrar na justiça por danos
13380,b5f76c3201d925951a9a78bc0c2ec81e,Potential Loyalist,1,Não recebi,Ainda não recebi
13325,9361aa5e3772dd008881e7126471406d,Potential Loyalist,2,Não chegou! ,"Chegou o kit da colcha, porém não chegou a manta Rosa, e no app esta com entregue. "
13327,3f2d7b08a695103e3929c7d99b9416c4,Potential Loyalist,1,Horrível ,Comprei uma coisa e me entregaram outra e não consigo fazer a troca e não consigo falar com a central !
13383,1fbf3a918dba47afb6162c450572a4ba,Potential Loyalist,1,Produto não foi entregado,"A capa de colchão azul marinho não foi entregue e consta no site que foi entregue!!!
Aguardo a capa de colchão solteiro azul marinho pois não veio e está constando que me entregaram!!!!!"
13206,8acef68da17b8023883367ebeb54b7e9,Potential Loyalist,1,Não recebi o produto,Não recebi o produto 
13186,19ec0b29446735170b035f6d2abcd667,Potential Loyalist,1,Faluana receber um produt,"Não recebi a arandela, apenas os números. Gostaria de saber quando vou receber pois estou precisando urgente. "
13224,7fd460732747aad1fe20e1049400c03d,Potential Loyalist,2,Recebi pedido incompleto,"Foi entregue somente parte do pedido, sendo que os produtos eram da mesma loja"
13237,fd03cb02bafef5b11f61adcd3184fc76,Potential Loyalist,2,não recomendo,não atendem solicitações 
13238,7a4a9aa0d9218320db34205e04d29b03,Potential Loyalist,1,ruim,"nao recebi a entrega completa , so me entregaram a base faltou o carrinho e o bebe conforto "
13440,b22b660b766eee055f792b62d1f38cbc,Potential Loyalist,1,Produto não chegou ,Ainda não recebi meu produto. O prazo já passou em dois dias e nada. 
13632,60863e9f13562f664b73e6f76ff85910,Potential Loyalist,1,Não Recebi o produto. ,"Não posso avaliar porque NÃO RECEBI O PRODUTO.
GOSTARIA DE SABER PRA QUEM FOI ENTREGUE SE EU MORO SOZINHA?
Aguardo solução para o problema."
13636,67bddde1844b238fe25995cde1612b4e,Potential Loyalist,1,Arrependimento total ,A impressão do quadro é péssima. Detestei e estou tentando fazer a devolução do produto
13551,a9b6d80e254b0f93b70290ab21447f03,Potential Loyalist,1,PRODUTO DIFERENTE,"A EMPRESA ENTREGOU OUTRO PRODUTO NADA A VER COM MEU PEDIDO EM FOTO
NAO COMPRE"
13454,2313db670eeaca592808e42e480e7b80,Potential Loyalist,1, DUVIDA!,"CONTROLE AQUARIOS DEVERIA LIGAR TODOS OS CONVERSORES AQUARIO, MAS, TENHO 2 TIPOS AQUI E NÃO FUNCIONOU EM NENHUM. PARA EVITAR TRANSTORNOS COMPREI UM CONVERSOR AQUARIO DTV 8000 NO baratheon E LIGOU."
13489,0025795df7a7d077c4c90162fa820085,Potential Loyalist,1,Falta de comunicação ,"Não um telefone onde podemos falar sobre o deu errado, e por email não obtive resposta"
13497,fad1bbf902fbdf64f92f33d010ab8cb7,Potential Loyalist,1,Nao chegou o produto,"Chegou a nota fiscal e nao chegou o produto , liguei nos correios e eles falaram que só chegou o envelope, quero saber sobre o produto , e o codigo de autenticidade nao confere , da no nome de outra ."
12802,6aed4780087d19b458dc4852efe0ceff,Potential Loyalist,1,Não condiz com o original,"O cartucho que seria de alto rendimento, na verdade não durou mais que 100 impressões, a maioria em modo rascunho.
Quando utilizo o cartucho 664xl original , ele dura em média o dobro."
12847,d3825147a5671fc987925a4da1b15ead,Potential Loyalist,1,Produto ruim,Setup é chines não funciona corretamente.
12789,0a310f2b5dba96e9efede8f5640f0acb,Potential Loyalist,1,Produto bom ,O tamanho é pequeno e percebi depois que no anúncio não dá destaque as dimensões do produto. Deixa a desejar 
12710,622be3abf5853ebb483f789b34b08d1b,Potential Loyalist,1,Não recomendado,"Apesar de estar no prazo de entrega o produto demorou muito para chegar, fiz o pedido do mesmo produto em um concorrente do stark que entregou bem antes."
12633,c8dd9f997f6c6d0765c75a0cc0b72a7d,Potential Loyalist,2,Perto de vencer,"Perto de vencer a validade. N foi informado de forma clara no anúncio. 
Claro objetivo de enganar consumidor."
12782,c2a88d9551b1cdb6ed5f3177e8c71523,Potential Loyalist,1,Me enganaram... ,"Comprei o tapete com a metragem 2,50 x2,50 e me mandaram a metragem 2,0 x 2,50, sendo que no siteo valor dessa metragem que me enviaram está bem abaixo do valor que paguei..."
13079,383a372bb06ef1c032c7dc50636eee24,Potential Loyalist,1,Luminárias,"O produto veio faltando uma unidade, e ainda não consegui entrar em contato com ninguém para solucionar o problema. Gostaria de saber como vai ficar agora?..."
13077,6aafc69e80792b9414523f5c1ea0beeb,Potential Loyalist,2,Não recebi ,Ainda não recebi e quero cancela a compra 
13104,7c3de819c5c8202f72ba56ff8f51ae39,Potential Loyalist,1,Produto entregue incorret,Produto entregue não foi o mesmo do pedido.
13122,415b073d153528fa1ed35a42e39945da,Potential Loyalist,1,Avarias na prateleira ,Recebi o produto dentro do prazo porém o mesmo estava quebrado
13123,415b073d153528fa1ed35a42e39945da,Potential Loyalist,1,Avarias na prateleira ,Recebi o produto dentro do prazo porém o mesmo estava quebrado
13030,d4e6dfcac8c74ccb645213f3af53bfdb,Potential Loyalist,1,Recebi o produto errado,"Recebi um produto da mesma marca, porém inferior ao que eu havia comprado, sem aviso algum do fornecedor."
12962,8b3b343b297bb6838ffb9221d68b1a5f,Potential Loyalist,1,2 dias fora do prazo,2 dias fora do prazo já mandei email pra empresa e ninguém responde estou preocupada de não chegar meu produto tenho urgência em usá-lo já está pago já passou do prazo e ninguém me comunica nada sobre
12973,43860f86362fea12550bfa19ef73015f,Potential Loyalist,1,Pessima,O produto chegou e estragou sozinho
12974,b05a0be462115e2c6e1580b127161643,Potential Loyalist,1,Recebi o produto errado,Comprei o Iso X e recebi o Nitro Hard 
13000,c18287f3d96045bad031c170dd939c74,Potential Loyalist,2,entrega Pifia,desde que começara a trabalhar com parceiros a entrega ficou ridícula
13671,6c0e6ce5291a3b16d57fcbce64f2aaf7,Potential Loyalist,1,péssimo,"Eu pedi o cancelamento desse produto antes de lançarem a nota fiscal, vocês deram continuidade no procedimento e entregaram o produto que infelizmente meu zelador recebeu, mesmo tendo sido orientado"
14506,9864e405ffd4792b33e48e3976a6a2f9,Potential Loyalist,2,Veio outro produto,Comprei uma pelícola do Moto Z2 Play e veio do Asus ZenFone 4 Selfie. Os tamanhos de tela são diferentes. Sacanagem.
14525,073eb65c7b6cef57bc5be329667b35fb,Potential Loyalist,2,**,"Os dois cartuchos preto não soltam tinta. 
Não imprime nada . Coloquei de maneira adequada e o cartucho não libera tinta preta. O colorido está tudo OK. Coma faço para resolver este problema???
Agu"
14543,1203dc7baad4bababc755c6c39936954,Potential Loyalist,1,Entrega incompleta,Só recebi um relógio ontem. A empresa não me enviou qualquer informação sobre entrega separada dos itens e prazo para entrega do outro relógio. Enviei email informando e ainda não obtive retorno.
14596,29a42800a23063e555b08f02bbabb3f3,Potential Loyalist,2,Ruim,Recebi o produto antes do prazo mas veio com defeito no zíper.
14359,c62e4182e8bbda08640afddbd6e9473a,Potential Loyalist,1,ruim,Comprei um produto de 250m e recebi um produto 100m
14326,7937be50771f5a064440463094da5820,Potential Loyalist,1,Quero devolve-lo,
14822,4b1d6757fbad7cc721dc384757e2433a,Potential Loyalist,1,Boa loja,"Deu tudo certo, até testar o produto que não cumpre o prometido, a garrafa não funciona direito, por isso quero devolver, péssima compra."
14853,8939cd9842c30470de2adf220eccbaab,Potential Loyalist,1,Nao recebi o produto,"Ainda nao recebi o produto, esta parado em Passo Fundo."
14872,eab79174774814600bb67d35d7564a3d,Potential Loyalist,1,Sem notícias sobre a enco,"Realizei a compra e não consigo rastrear o objeto e tampouco saber onde ele está e nem previsão de sua chegada. Porém, a compra já veio na fatura do meu cartão. Lamentável."
14927,81886a904fd1466adf8129fc130982af,Potential Loyalist,2,qto ao baratheon sim ,"A bolsa veio com a costura torta no ziper, e nesta costura por estar torta, não foi costurado o ziper, então está um buraco, não gostei, preciso ver o que devo fazer..adoro o baratheon,mas não produto"
14930,0abff5377bf2207c0015063059d8675d,Potential Loyalist,1,Faltando produto.,"EM UM DOS FRASCOS ESTAVA FALTANDO 20 CAPSULAS, ACHO UM ABSURDO A GENTE COMPRAR UM PRODUTO TÃO CARO E AS PESSOAS TER A CORAGEM DE FAZER ESTE 
TIPO DE SACANAGEM."
14769,c4e2475e00e1b2f1a420b39d13b3f208,Potential Loyalist,1,Protudo diferente da foto,Quero devolver produto ja solicitei devoluçao
14665,545bd0b3119518f1821332f395226501,Potential Loyalist,2,Recomendo.,Apesar da demora na entrega. No mais foi tudo bem.
14734,e74f77ff1fc653fe5ce9ca3f87f41704,Potential Loyalist,1,Recebi metade do produto,"Fiz a compra de duas mangueiras expansíveis, e somente recebi uma delas. Como o pagamento do produto adquirido foi feito com cartão de crédito, quero saber quem vai me restituir o valor ?



"
14756,61d6eaa71eb1a2243e511679e1818b91,Potential Loyalist,1,NÃO RECOMENDO,"O PRODUTO QUE PEDI NÃO CORRRESPONDE AO QUE FOI ENTREGUE, TOTALMENTE DIFERENTE."
13896,420f8f6bb49a30d3c359aa5cc905288c,Potential Loyalist,1,Horrivel,Não sei como nos dias atuais ainda existem lojas assim. O prazo de entrega já é muito extenso. E o maior problema de todos: o item não foi entregue!
13929,3058f602e8fc1b30ab963bef876e3eca,Potential Loyalist,1,Produto errado,"Mais responsabilidade com os clientes quanto origem do produto,qualidade,certeza de que o produto entregue é de acordo com o pedido "
13937,7b63dc606147754731a3024c85f6edba,Potential Loyalist,1,Péssimo o retorno ,Solicito o cancelamento.
13938,6a9501d542243cbdd043c91a66795279,Potential Loyalist,2,Achei estranha a embalage,"Recebi o produto numa embalagem de papel, geralmente esses relógios vem numa embalagem de materiais duro etc, fiquei com medo de ser falsificado. "
13973,d843c40bc99833fc73018f635420b8bb,Potential Loyalist,1,Não é original ,"O produto é bom, porem é vendido como se fosse da Sony (original) mas na verdade não é original e sim uma réplica. "
13984,2d53a06bc53cb76c5744e1659361aaf2,Potential Loyalist,1,REPROVACAO DO PRODUTO,"A entrega foi feita corretamente, dentro do prazo. Mas a qualidade do produto nao eh das melhores.."
14030,be03685420bb977861dda08f4b4088b3,Potential Loyalist,2,Mesa com cavaletes ,"Demora absurda para entrega, dentro do prazo especificado por eles, mas ainda sim muito demorado!"
13694,1a9725a6faddf68070a71a25bf695a39,Potential Loyalist,2,nao recebemos....,"Não recebemos ainda como dar opiniao ou avaliar?
Com prazo para responder se recebemos ou nao?"
13697,f02718b711fcef6de51bd38c643a236e,Potential Loyalist,1,Veio faltando mercadoria,"Essa semana recebi o produto, mas não veio completo, veio apenas 1 frasco , sendo que no anúncio dizia 3 frascos. Aguardo posição da empresa. Porque até agora não tive nenhum e já entrei em contato"
13740,f42015042a0a93d1e860d63a5cc2fbcb,Potential Loyalist,2,Bonito.,"Um relogio Bonito, más sò pode ser usado o mínimo possível pois lavei as mãos e ele encheu de água. "
13743,031cbbcf2be8c834d2d5d25d3ee49926,Potential Loyalist,1,Relógio ruim,Propaganda enganosa lá na descrição diz que o relógio é isso e aquilo que é bom e tal mas na verdade não é nada disso além de tudo a cor que eu pedi foi dourado e veio uma cor que não é Dourado.
13819,a8a049e8e48d57264919233b49f5367f,Potential Loyalist,1,produto com defeito,"comprei dois cartuchos de impressora que vieram embolorados, e falsificados.
e agora?"
14291,8aceaff31bf558470ed6433f264633aa,Potential Loyalist,1,Comprei 02 e só recebi 01,Comprei 02 balanças e só recebi 01. Mandei mensagem e nada até agora.
14103,c1e46a3c0e43e74dc1a0704323c2ee3d,Potential Loyalist,1,Produto faltando,"Boa tarde !
Comprei tres produtos so chegou dois, por isso nao tem como eu responder que meu produto chegou. Por favor resolvam isso."
14156,8e29799c4ba7191b201ee13f4acece91,Potential Loyalist,2,Regular,"Não gostei. Muito fina. Não é cara, mas por esse preço compro uma melhor."
14158,24a305ebd4a90674972ca0db342eccd7,Potential Loyalist,1,Entrega Danificada,"Produto chegou danificado, com rachadura no corpo da fonte, entretanto funcional.
Mas o fato do produto chegar dessa forma, demonstra que o vendedor nao tomou os devidos cuidados no envio."
12610,37aa16c68f12a40642fb9f2cb2555db9,Potential Loyalist,2,bom,não usei o produto não mas parece bom
11046,176c21456fab655afee57b3ea9799f47,Potential Loyalist,1,Produto incorreto,Produto diferente do anunciado 
10753,f74c8f68bd37ba2c2e6e0f5ed1918a46,Potential Loyalist,1,nao recomendo ,ainda não obtive resposta do porquê do atraso
10806,43e153a2e8f22e54e3c59a6555bce16d,Potential Loyalist,1,Erro na entrega,Recebi produto errado e não consigo retorno da loja! Continuo sem meu produto!
11072,ec1a0d4260a3e573def909c95c1dc0c5,Potential Loyalist,1,Horrivel,Recebi um produto diferente do qual eu pedi
11314,c8ebb17d3f42219f10a9985722d16906,Potential Loyalist,2,Incompleto,"Veio só as cortinas, não chegou o jogo de lençol"
11365,c489e88397e376f0e402e81e34c5c40d,Potential Loyalist,1,Cor do produto errada ,"Muita falta de atenção, pedi as toalhas pretas e vieram brancas. "
11273,5224b7a19a39296f9ac2a9b492d08290,Potential Loyalist,1,Passou o prazo de entrega,Já passou o prazo de entrega e ainda não recebi o produto.
11143,31c8bea35443dd560ea09d74e7970583,Potential Loyalist,2,Produto não entregue,Gostaria de informações sobre a não entrega do produto.
11239,68404858b74fd9d52b315241733570c9,Potential Loyalist,1,Ruim,Não recebi o produto
10740,c77a1d7ea4d97301c38bf7c7c87d95c1,Potential Loyalist,1,RUIM,"Não recebemos as notas dos produtos, como isso é possivel, é gravíssimo transporte sem nota fiscal, o cliente fica sem garantias, no site do stark não é possível imprimir, preciso das notas."
10350,7cc5c190ee98d000eda540e331afa10c,Potential Loyalist,1,Produto diferente,Comprei preto e veio Prata. Já fiz a reclamação e estou aguardando contato da empresa targaryen.
10305,8ee17b389ad6645bf25242a99cdd729a,Potential Loyalist,1,Regular,
10429,0a7cf55a3e4dcf8fdf11f6fd62c85803,Potential Loyalist,1,ainda não recebi ,"Meu produto ainda não foi entregue.
Pode ter sido por falta de gasolina no pais mas mesmo assim preciso de uma posição de vocês."
10440,1772d62f5099be6942fbb3d3e881cc7c,Potential Loyalist,1,Produto sujo,"O produto veio em mal estado de limpeza, parecia já ter sido usado, o espelho riscado"
10738,2ed0fed2170249d11a69c5406a3f8d1b,Potential Loyalist,1,PESSIMO,"LOJAS lannister ESPERO O RETORNO DE VOCES!!!!!!!!!!!! FIZ O PEDIDO DE CANCELAMENTO ASSIM QUE A MERCADORIA CHEGOU E JA ESTA ACABANDO O PRAZO ATE AGORA NADA, RELOGIO CASIO PEQUENO DE CRIANÇA!"
10195,aea26aa7c46bae30ac9efa7f048d1c6c,Potential Loyalist,1,Regular,"Meu kit nincho venho com umas lascas na tintura ,, acredito que devido ao manuseio do pacote e tbm da transportadora."
10210,8d012e5624230adec4cdda50a1070f0a,Potential Loyalist,1,tablets quebrados,"alguns tablets de bcaa vieram quebrados, diminuindo a qualidade do produto"
10693,338b674e2479fcfdc47cefeba0a41385,Potential Loyalist,2,não recomendo,O produto não é aquilo que pensei. Parece imitação bem barata.
10702,8a0df18411d1bf7dce301f9ac9166872,Potential Loyalist,1,Produto veio quebrado ,"Estou aguardando posicionamento da loja, pois o produto veio quebrado em 3 partes"
10707,d2302d80561ca01cf25096d0a28f07b4,Potential Loyalist,1,Falta de produto ,Comprei duas cortinas porém só veio uma cortina na nota consta duas gostaria de saber o que vai ser feito porque isso é falta de respeito com o consumidor que compra e quer recebe aguardo retorno
10483,a4e9d1568df5584556b6a4d871095249,Potential Loyalist,1,Falta de comprometimento ,Comprei e as cores vieram todas erradas e escolhe com tanto cuidado e veio td diferente não compro mais pq ate vc tentar e conseguir trocar muita dor de cabeça 
10489,4f74cbce7c21bd285c7711c150214533,Potential Loyalist,1,Paguei e não levei!,Paguei e não recebi o produto. E agora???
10520,0f3a5db8a7909671d8032ffb079c1509,Potential Loyalist,1,Produto com defeito,"Ao ligar o farol uma das lampadas da uma leve oscilada e as vezes apaga sozinha e depois acende novamente , já troquei de lado as lampadas e o problema persiste."
10529,8e893b1fd968d05f7ad2b068e502e280,Potential Loyalist,1,Produto não entregue.,"Infelizmente, a empresa trabalha com os Correios, que nunca cumpre os prazos de entrega."
11446,dd9b235dbe7d48c82caca4da097a2240,Potential Loyalist,2,Recebi só 1 de 3 itens,"O site do stark consta meu pedido como totalmente entregue, mas recebi apenas 1 de 3 itens. Já comprei antes com a targaryen e gostei, a entrega foi super rápida. Mas não concordo com constar meu pedi"
12152,6fc51883c0e6073fa9e9ce1ccd51017d,Potential Loyalist,1,Péssima qualidade,"A pintura da placa é de péssima qualidade. Após manuseio para instalação, as bordas começaram a descascar. A impressão é borrada, sem nitidez, não corresponde à foto de apresentação. Não recomendo."
12237,1bdafae1c7027a28342348f48574e3e6,Potential Loyalist,1,Produto mal embalado ,Produto chegou com risco e manchado. 
12244,c30681b57912b2575b9b589371ac545c,Potential Loyalist,2,obrigado produto bom,"bom produto , vou ainda fazer o teste da lavagem ainda "
12149,6be90bc12a5834bb6bbe23c4901d0dc1,Potential Loyalist,1,RECEBI PARTE DO PRODUTO,"O pedido é um móvel com fruteira, acontece que ontem, sábado dia 09/06 só recebi as bandejas da fruteira, e a nota fiscal referente ao valor total do móvel, foi minha irmã que recebeu, q]"
11454,bd5087dfce936421860ac7bd9a7a8055,Potential Loyalist,1,Meu produto veio errado,Meu produto veio errado outro modelo fui trocar não tem mais
12119,b5e63d6b2fd9d506721abd938264c4f0,Potential Loyalist,1,ainda não recebi ,"Ainda não recebi produto e já enviei mensagem para a loja sobre tal situação.
Estou aguardando resposta
Sempre comprei na loja e nunca tive problema, espero que agora resolvam a situação"
12094,6d21f55d799dc99aacdea8d8123903fb,Potential Loyalist,1,Não gostei!,"o suporte pra grelha é bem mais fino e frágil, a cuba tem várias marcas de solda em diversos pontos o que dá aparência de um produto feito em um ferro velho. "
12345,b51991f256324aac39d7c5a45030eeaa,Potential Loyalist,1,pessima,"Produto de péssima qualidade,não recomendo."
12517,71a80518a42749afd7b9d072618cc604,Potential Loyalist,2,Estou no aguardo ,Estou no agurdo do meu produto
12524,a331b262a1e59c1452d774af0e33c465,Potential Loyalist,2,RECEBI SOMENTE UM PRODUTO,FIZ A COMPRA DE DOIS PRODUTO E SÓ RECEBI UM PRODUTO E FORAM COBRADOS DOIS PRODUTOS.
12545,e6b0c834e907755bb377c552f5259f1a,Potential Loyalist,2,Regular,"O brinquedo veio com defeito,a dificuldade em trocar está pq minha filha chora quando proponho para ela esperar uma semana pelo outro."
12563,25bedfc6317ec4a379ef49b9c1049733,Potential Loyalist,1,"Não recomendo, golpe!!!","Não me enviaram o produto, só me enviaram uma nota fiscal estou sendo roubado e ninguém resolve meu problema."
12423,e8f9040fd2735978f747176a6a9b4cde,Potential Loyalist,1,Produto de mal qualidade,"Material que foi feito a bolsa , e muito fraco e de péssima qualidade. "
12435,7917d21aa2aea63b89c7d6f23f29f382,Potential Loyalist,1,qualidade duvidosa,"O produto na parte de cima pareceu bom, mas a parte de baixo, de borracha sai um cheiro extremamente forte. Não consegui usar no carro, fiquei sufocado. Quimica da borracha é muito forte."
12468,d399fa2119d7420b2b03e33536b7f549,Potential Loyalist,1,Meu produtor n foi entreg,Meu produto não foi entregue ainda. E o vendedor não me dar nenhuma satisfação eu já mandamei vários email msg de reclamação é até agora nada foi feito 
11613,ac24803bdce566fa275258a3a91ad3a9,Potential Loyalist,1,Produto não corresponde,Comprei uma garrafa que era pra ser térmica e de térmica não tem nada
11764,b3a1a221ad27da82c2973f1a108f939c,Potential Loyalist,1,ENTREGA INCOMPELTA,ENTREGARAM 1 DOS TRES ITENS COMPRADOS QUE CONSTAVAM NA NF
11519,0734186c93d9d5488a3a77c8178cb794,Potential Loyalist,1,Entrega errada ,"Fiz a solicitação de devolução, pois comprei a película para o zenfone 5 selfie e veio o do zenfone 4"
11531,0988bf3de31325af88e3130ee3e5f821,Potential Loyalist,1,Não Entrega De Protudo,Meu Produto Ainda Não Foi Entregue.
11538,eb84790df0e0118db2b14bc0868805d7,Potential Loyalist,1,PRODUTO NÃO ENTREGUE,Gostaria de saber pq o produto não foi entregue. Gostaria de uma solução 
11965,90493eddf464bdf21a99316550f23da4,Potential Loyalist,1,Devolução e troca,"Comprei um carregador Motorola turbopower 15W, mas chegou aqui em minhas mãos um carregador que não encaixa em nenhum Motorola, testei no Moto G4, G5 Plus e G5S Plus, e em nenhum deles o USB encaixou."
11886,47dae9705bc097617f823f7cbedca145,Potential Loyalist,1,Produto não funciona,No primeiro dia que utilizei o produto o mesmo já não funcionou.
11916,70e892a5cad6f85f02964619c2ed74b7,Potential Loyalist,1,UMA MERDA,O produto veio TOTALMENTE errado. Ainda não tive retorno da minha mensagem sobre a devolução do meu dinheiro. 
11931,0a7b2b70778551b43a7a68b65e4e3373,Potential Loyalist,1,A composição do produto n,A composição do produto não corresponde ao anunciado.
11964,9691d22346754dd206a2b68a0b418096,Potential Loyalist,1,Péssimo ,A alça da bolsa arrebentou no segundo dia de uso. Simplesmente se desfez. Minha filha ficou atrasada!
11798,c5dc5c2635cadde29865e0a2d9611658,Potential Loyalist,1,Nao recomendo ,"Qualidade horrível, cor totalmente diferente da propaganda que mostra e fala. Fui obrigada a dar 1 estrela se nao, não enviaria a avaliação. Mais a nota de tudo é zero estrelas, zero em tudo"
11807,3deb4a6474e67d18f2a230a98fbf2f0d,Potential Loyalist,2,Não veio a garantia ,"Sem garantia, vou levar numa loja pra saber se é original "
11821,e608691ff0899ed4f5894bbf8eec599a,Potential Loyalist,1,Desconfie duplamente,"Duas coisas inquietantes: na nota fiscal só consta 1 frasco, deveria ser 6; a inf. nutricional dá 100% de V/D por cápsula e o modo de usar recomenda o consumo diário de 2 cápsulas."
18357,80858bc1ad0b7a63c5b87b3baf4fe309,Potential Loyalist,2,A película não serviu.,"A capinha ficou certinha, mas a película é menor que o celular."
18415,b6a70553f73cde17709a32cb714a40eb,Potential Loyalist,1,não recebi o produto ,não recebi o produto que comprei e paguei
18319,3279712e1ea8d52462488b4fb9dd7014,Potential Loyalist,1,Encomenda em atraso,"targaryen não entrega no prazo, total descaso com o cliente!"
18140,3b2f809a7f9407e51e9173b4a96d659a,Potential Loyalist,1,nao recomendo o produto,não há descrição do produto algum e recebi uma cortina de plastico
18150,06d2f8b660a9c52438a6aa591c6a4244,Potential Loyalist,2,Entrega 🚚 ,"Infelizmente entrega ainda não efetuada, ainda aguardando para que eu possa testar então dar minha opinião. "
18151,ab4f9957c5cee6d8b99de10856e13822,Potential Loyalist,1,Bom,Não veio a embalagem certa
18202,36128496a8835d7db5a8b51f0bba64e2,Potential Loyalist,2,Nao consigo contato para ,Nao consigo contato para pedir de volta meu produto uma vez que falaram q estaria disponível ate o dia 5 nos correio o qual voltou dia 2
18231,0aacde7f3bda1ae91da7289dcb1c2a5c,Potential Loyalist,1,não recomendado,Não recebi minha compra dentro do prazo. Estou aguardando mas parece que a única solução dada pelo site é cancelar o pedido (o que não vai acontecer). Preciso do produto! Aguardo retorno
18232,c071f952b577ad0a23ae9a9683f2c092,Potential Loyalist,1,reclamação,produto incorreto
18485,e0f506d786d1eebae7716936b4284b54,Potential Loyalist,2,insatisfeita,"Não considero que recebi o produto exatamente como imaginei, pois na imagem ilustrativa constava uma capa para a garrafa térmica, a qual não acompanhou o produto, não comprei em outra loja mais barata"
18738,5cbc208c3c4c9a4c7bb48a44b00e53cd,Potential Loyalist,1,Produto diferente,Comprei um produto de 180 reais e recebi um completamente de 50 reais. Um absurdo
