,customer_unique_id,segment,review_score,review_comment_title,review_comment_message
9796,e093c00d1a7972c2a479ed40e648ee00,Potential Loyalist,1,demora na entrega ,atér o momento não recebi meu quadro!
9674,6afe12a6671753d4c6e52acc8438910b,Potential Loyalist,1,Não recebi o outro produt,Eu não recebi o outro produto
9658,611fe38d3860caa312a7e702f2b8f97c,Potential Loyalist,1,Meu produto veio errado,"O pacote até chegou, mas quando fomos abrir para conferir e usufruir do mesmo nos deparamos com outro produto totalmente diferente sem nenhuma característica do que realmente pedimos! Oque devo fazer?"
8947,5691d9e7584b97e1b450398f3476b800,Potential Loyalist,1,Não recebi as cadeiras,Assim que receber posso avaliar
9836,a5c3e82a63848cb08546796194121927,Potential Loyalist,1,Decepção,"Infelizmente, virou regra no Brasil, o consumidor comprar, pagar e não receber o produto. Prazo tem que ser cumprido e, a responsabilidade é do vendedor."
10066,0bfe461ce9bb2a820de70ec1b8113b00,Potential Loyalist,2,Mais ou menos ,Quando fui colocar a lâmpada quebrou o parafuso dai colei . 
10026,fa717cacb6498a3e9842542158ab5dcd,Potential Loyalist,2,2,"Produto chegou errado, preciso que resolva com urgência"
10027,881483770fdbfedae83075ad3ac0a289,Potential Loyalist,1,Um desserviço ao cliente,Comprei dois rolos de papéis de parede conforme anúncio.... Recebi dois rolos de cor caramelo e flores bege (horrorosos de feios).... Totalmente em desconformidade... Abri reclamação... Péssimo !
10049,db8c45be1c952ca0d0938c85dadc8cb2,Potential Loyalist,1,Bom recomendo,"Bom produto, recomendo o vendedor. Mais nada pra comentar do produto e do vendedor também."
10087,5824772f55a94d6c06cbd5df136f5ba4,Potential Loyalist,1,Ofertado/Pago lannister,Não interessa se opera Market Place. A compra foi feita no site da lannister e pago para lannister. Se tiver que ajuizar vai ser contra lannister e lá faça o regresso contra o fornecedor.
10115,675b17ac4da7e93fb1728c7b2bd5e1d7,Potential Loyalist,2,Encomenda pela metade! ,"Fiz a compra de duas araras de roupas e recebi apenas uma! Sendo que efetuei o pagamento de duas! No recebimento veio a NF com o valor de 2 e apenas 1 mercadoria , espero receber em breve a outra!"
10134,9a56543de3e80d01d760a903298602cc,Potential Loyalist,1,PROPAGANDA ENGANOSA,Não enviaram produto conforme o anuncio.A targaryen anuncia um kit e so te enviam um produto
10143,68d5ca3060848f1b0171d97268b7b830,Potential Loyalist,1,péssimo,"além de ter sido muito mal embalado sem nenhuma proteção e por isso chegou completamente danificado, a mesa é bamba e o apoio para o tampo é ruim e fica escorregando, tive que improvisar."
10006,d838e273e0dc315947e508ec7bb28de0,Potential Loyalist,2,Produto diferente da imag,"Na imagem é Cola Premium Black de 10ml e foi entregue Cola Elite Glue Black de 05ml. Compro muito no site das lannister e essa foi a 1a vez que me senti lesada, enganada."
9930,4e1554d1a2dcb38dcf22770eb7390fe1,Potential Loyalist,1,não recomendo,produto não veio conforme o comprado.
9514,83947230de9d7dd167a59ffdc8efc11a,Potential Loyalist,1,Produto faltando ,"Efetuei a compra de 3 peças , conforme descrito na nota fiscal, mas ontem recebi apenas 2. Está faltando 1 peça, entrei em contato imediatamente com o site e informei o ocorrido e ainda não respondera"
9234,c28c2e63e85e56bd2c80ba1c844a4704,Potential Loyalist,1,Negativo ,Recebi o produto diferente do q comprei
9179,ac2a428ee8e0732d74df9340667b0f30,Potential Loyalist,1,Toalhas de banho,"Nao gostei do produto. As toalhas sao muito finas, nao enxugam!!! Infelizmente vou pensar se vale a pena comprar pela internet sem manusear o produto, principalmente toalhas de banho."
9180,c864fe0c9f4b9010508388922c2b21ae,Potential Loyalist,1,Ruim,Comprei um produto e recebi outro
8950,4ebee1080326aba561d90bed5039f4e1,Potential Loyalist,2,Nota Fiscal ,O produto é bom porém a nota fiscal veio com o nome da pessoa que recebeu sendo que o pedido foi feito em meu cpf. Caso precise trocar ou fazer alguma coisa não vou poder porque está em outro nome 
8954,df54a349b0edb7f8420cd864c0561770,Potential Loyalist,1,Produto chinês ,"Propaganda enganosa de produto chinês. Não vale 50%do valor cobrado. Não é impermeável, não tem couro na composição."
8961,22a93d651c1f3443f3547fcfd9619840,Potential Loyalist,2,nao recebi o produto,Eu não recebi minha apostika e fui nos correios e ela não estava lah tambem
8966,31499e721c936ac2d180f41d65208dea,Potential Loyalist,1,Péssima compra ,O produto ainda não foi entregue e já passou do prazo.
9017,32bfd5f49a904f938574ab461ce740bf,Potential Loyalist,1,Nao chegou,Meu produto ainda não chegou
9237,77843cf7c32c114848e2ff13049544d0,Potential Loyalist,2,Razoável,Apenas a imagem das fotos é muito ruim. O restante é bom.
9503,8a452cfa2b4925714df38aafd059e7a9,Potential Loyalist,1,pessímo,"qualidade do tapete muito ruim, suja só de encostar e tamanho menor do que o especificado."
9439,8c663cd9be4218ae3ac99b241991bd12,Potential Loyalist,1,Produto não foi entregue,Até hoje o produto não foi entregue.
9455,6497524b55cbe8996aa46912e3614290,Potential Loyalist,1,Só veio uma cortina,Não recomendo está loja ... pois eu comprei duas cortinas iguais e só me mandaram uma e na nota veio com quantidade de duas... já liguei para a Americana e questionei estou aguardando uma posição
9492,abe4bd472d7df9bb5fe8bf3ea6e34e0f,Potential Loyalist,1,PÉSSIMO FORNECEDOR,"COM O PÉSSIMO SERVIÇO DE ENTREGA NAS COMPRAS ATRAVÉS DA INTERNET, VOU CANCELAR TODAS AS COMPRAS. NÃO ESTOU SATISFEITO COM O ATENDIMENTO NA ENTREGA DOS PRODUTOS COMPRADOS. PEÇO PROVIDÊNCIAS."
9270,d3d7ef5288ec60b1abfd7e93fe7cdc0b,Potential Loyalist,1,Não recebimento de um pro,"Gostaria de uma posição coerente quanto a chegada do meu produto, pois desde o dia 11 era pra ter chegado e até hpje nada, nem sequer consigo rastrear!!"
9280,100a1a0fe9f738719f7b63e3eadf5ebe,Potential Loyalist,1,desagradavel,"Eram mais de um item e até agora só chegou a panela de pressão . Estou habituada a comprar nas lojas lannister e tenho esperança de receber o que paguei.
Kit Vitrificador de plástico e Revelador de "
9285,e210ba7ec6880abcc06096731feaa8bc,Potential Loyalist,1,Produto de péssima qualid,Péssima qualidade pano ruim todo ruim não é o que apresenta no site quero ser ressarcida quero fazer devolução por por incrível que pareça já solicitei a soltado evolução e quero meu dinheiro
7541,811aeaa2693a92f00fa1d7e92a2e5910,Potential Loyalist,1,Perfume é FALSO,"Comprei um perfume para minha esposa, o produto chegou agora mas é MUITO falsificado... claramente! Me sinto enganado! lannister.com.br vendendo produto FALSO!!"
7540,eaaff84ebc1c020ab83950d9303a8e97,Potential Loyalist,1,Toalhas de má qualidade ,"Bom dia , as toalhas são de ma qualidade super finas , parece ate mais pano de chão."
5558,84e608f9dafd94d0749f99368bec4ff5,Potential Loyalist,1,Regular,Bom dia. Por favor pode me informar se vcs já me enviaram meu pedido de volta? Estou no aguardo. To precisando dessa mercadoria!
5638,5a04b8d0b0186a8c54bf27375f3fb3e7,Potential Loyalist,1,Não recebe minha encomend,"Ainda vou vê se chega a tempo marcado
Aguardando minha encomenda"
5655,c07b7aa6f18fd8abce31169a600ec511,Potential Loyalist,2,Faltando produto,"Recebi apenas o kit com capas para travesseiro, não recebi a capa de lençol. "
5544,a1037cdfc5b17d41ac68e20a1c4ec4fd,Potential Loyalist,1,não recomendo,"Produto entregue errado, comprei um produto recebi outro totalmente diferente."
5541,e2b6d6a4c85c57683fa019d2516cbb9f,Potential Loyalist,1,ENTREGUE PELA METADE,"Comprei duas unidades do produto, mas no pacote só veio uma."
5469,eb7f6a96757f0ef3ffd4eadacde32cab,Potential Loyalist,1,Recebi apenas um produto ,Faltou o produto coberdron de solteiro.
5476,46450c74a0d8c5ca9395da1daac6c120,Potential Loyalist,1,Produto errado,"Entrega do produto diferente do solicitado
Aguardo orientação para a troca"
5498,f5118eeb269b3a52b8b31bcde5b334c3,Potential Loyalist,1,Produto,Eu não recebi este produto e eu gostaria de cancelar o pedido.
5502,7557ea525045b036732491a790b284a5,Potential Loyalist,1,Metade do pedido ,"Pedi 2 unidades, recebi 1 unidade e na NF estava escrito 2 unidades. 
Precisei reclamar para tentar receber o produto, que segundo a loja, está na transportadora."
5707,fd301b685263a41db35c40a9cb884c0b,Potential Loyalist,1,Não recomendo,Recebi a mascara mas de outra cor. Infelizmente não pude fazer a troca pois já tinha jogado a nota fiscal fora
5910,b3e3ec0845892505e3d124a978cebf10,Potential Loyalist,2,Aperfeiçoar o produto,"As focinheiras n°s 01, 02 e 03 são ineficientes, pois o velcro está na ponta do tecido, ficando muito frouxa e o gato retira com muita facilidade, mesmo a n° 01. Precisa colocar mais velcro."
5968,4b4d80d39b3e76e3cf819e0189cea3e4,Potential Loyalist,1,Péssimo,"Recebi a mercadoria errada.
Comprei o chuveiro turbo mas entregaram outra marca além de tudo um valor enferior que paguei.
A targaryen disse que não tinha o produto certo e mandou a orientação para devo"
5896,20be0faca39cb65332e712f1060b24b6,Potential Loyalist,1,Réplica,"Comprei a armação como sendo um modelo original, ou seja, da marca targaryen. Mas, na verdade é uma réplica da Dior. Queria adquirir um produto ""sem marca"". E não uma réplica.
"
5851,7b70db47e11fe1776e5fad230f1a9be1,Potential Loyalist,1,reclamação,"Eu encomendei 2 mosquiteiros de solteiro Elegance e 1 queen. Chegaram 3 mosqueteiros de solteiro e nenhum queen. As 3 notas fiscais que vieram descrevem outros produtos, não os encomendados."
5726,25238cf185493ea8e19a5733165a0f56,Potential Loyalist,1,Falsa venda. Super não r,Não recebi nada. Fui enganada paguei um frete que não foi executada. Quero meu dinheiro de volta. Quero saber o que fazer para ser ressarcida.
5733,999c2da896c0a7e316253dd8b876242b,Potential Loyalist,1,Muito ruim,"Muito ruim, não recomendo "
4991,863c9a8df992728d25a783b95471b674,Potential Loyalist,1,Diferente,Material inferior ao que demonstrava na imagem. 
5108,49b6102818d64436b9013aa60b2b5ac7,Potential Loyalist,1,1,"Produto chegou danificado, solicitei a troca e foi negada, não teve outro jeito a não ser cancelar a compra."
4966,e9999972797e433766f3bca71104b263,Potential Loyalist,2,Caixa rasgada,"A caixa veio semi aberta 
Rasgada 
Em mau estado de transporte "
4866,25a31b44149e8e16ae85af1b3386a29b,Potential Loyalist,1,está faltando 1 produto,"não recebi o produto completo como deveria, comprei 2 unidades na mesma loja, porém só veio 1 unidade. Espero receber o produto que falta o mais breve possível."
4926,0ee049c61e2e6c30345e7c2480608d20,Potential Loyalist,1,Ainda nao recebi a compra,"Nao recebi a compra acreditando que seja por motivo TALVEZ da greve dos caminhoneiros, porem niguem entrou em contato para esclarecimento. Me gerando Dúvida realmente o que esteja se passando!."
5435,942459328c9b0b5c15d19e9400fd0f12,Potential Loyalist,1,Muito ruim,"O produto foi entregue em outra cor. 
Solicitamos rosa e veio preta. 
Também veio em outro modelo e não conseguimos efetuar a troca pelo site. "
5259,fe620e8f77c9a99d0f38a1809f785674,Potential Loyalist,2,talvez recomendaria,Frustração
5199,dd58c6e9567f274ae4d57af400fe1a40,Potential Loyalist,1,frete super demorado,um mês pra chegar na minha casa
5223,60dfa3ea01873e440cf35bccd839161f,Potential Loyalist,1,Insatisfeita,"Não recebi o produto conforme a foto do anúncio, já solicitei a devolução e ainda aguardo resposta.
Não fiquei satisfeita com esse produto que é inferior ao dá foto do anúncio "
5228,e336a9719ccdcfb34a02d22e84571527,Potential Loyalist,2,Falta de um produto,"Boa noite, conforme informei anteriormente, a espátula inox nao foi entregue, gostaria de saber sobre.? Grato Jean "
7069,29b712b57b3edce714dfa709e1ad63b7,Potential Loyalist,2,REGULAR,"O atraso e não envio das mercadorias a residência destinatário é culpa da Loja ou das lannister, que cobra por um serviço que não ocorre? Este só ocorreu pq houve reclamação, o outro foi pego EBCT."
7130,69e772acba5d86336594e13d79faaf2f,Potential Loyalist,1,Produto quebrado,"Estou tentando entrar em contato com vcs, mas pelo site não está dando. A vela veio quebrada, com o carvão saindo pra fora. Solicito a troca do mesmo. O produto chegou antes mesmo do prazo. Obrigada"
7151,287ae0a02c99fcc6944ae8922beb860a,Potential Loyalist,1,Enganada,"Comprei um relógio por ORIGINAL, além de vir falsificado veio com defeito, não funciona, e ainda me cobraram garantia estendida "
6938,3fd6764780fd9bcfb3c433fa5875b52d,Potential Loyalist,1,Quadro quebrado,"Infelizmente o meu quadro veio com a moldura quebrada, danificando a tela. Deu trabalho para concertar "
6877,30b94abdcaa5b08d5d78bb3bac7a594d,Potential Loyalist,1,Devolução do produto,"Prezados gostaria de informar que fiz a devolução do produto no dia 06/07/2018 e até o momento não recebi a devolução do valor pago, sendo que mesmo assim ainda esta vindo o desconto das parcelas ."
6929,bdee14a4f9d04d3b78a69f7ba1e82425,Potential Loyalist,1,Cancelamento Aberto,Estou com um cancelamento em aberto e o prazo de 48h já acabou e eu não obtive retorno. Sinto-me lesada: produto falso. Não arriscarei minha saúde com esse produto duvidoso. Aguardo retorno urgente.
6939,e67fade5c7d2afb5446c930b10210434,Potential Loyalist,2,Veio errado,Comprei bege e veio preto com desenho diferente
7418,3cde7b9c219893b4f0ddf18055ab5db1,Potential Loyalist,2,Recebi um produto com def,"Comprei uma lanterna holofote,que foi entregue com defeito, e quando tentei acionar a troca de produto não consegui falar com ninguém da loja então eu não recomendo esse sait pra ninguém, "
7450,d7def44f47f1bb64b770c438641a5f50,Potential Loyalist,2,Item nao entregue,Consta na NF 2 itens orem apenas 1 foi entregue. Ja solicitei informaçao sobre o item faltante.
7479,f324fb2ff71d3fe466169a995de25315,Potential Loyalist,1,Vendedor Horrivel,"O produto teve o pagamento aprovado 1 dia depois do pagamento, porem o vendedor esperou 6 dias depois para enviar faltando apenas 1 dia para vencer o prazo de entrega e o produto não chegou ainda."
7515,90c39917dd6b60958fa4d82444b91789,Potential Loyalist,2,potes herméticos ,otimo
7345,4399f1c9b351d4c09e167b8ce3d8da76,Potential Loyalist,1,Modelo errado,"Na foto o modelo é sh013, recebi um sh012"
7356,38c7094070cb00ac7c0f03e5624576d7,Potential Loyalist,1,não recomendo,"Recebi o produto errado, gostaria de devolver, e quero meu dinheiro de volta."
6333,207d998ffd9ef906e5b11fb465e43dd0,Potential Loyalist,1,Produto errado,"Além de receber o produto errado, não consegui efetuar a troca, devido a ineficiência do sistema, que não oferece ajuda suficiente. "
6423,f7d7fc0a59ef4363fdce6e3aa069d498,Potential Loyalist,1,Não recomendo,"Não recebi o produto, pois não recomendo esta loja, mais a responsabilidade é das lojas lannister
"
6073,8b1f294d23244901dae99e29bca2ebc1,Potential Loyalist,1,Incompleto,"Produto veio incompleto, faltando certidão de nascimento e a fralda e não encontrei nenhum telefone ou e-mail de contato para reclamação."
6088,894ff9cefb0f7e13b46dc360fb4d5c26,Potential Loyalist,2,Relógio não veio cm pedid,"Relógio muuuuuuito pequeno, ainda bem que sou magra . Ficou legal "
6107,5024a905691936575a6ae846c93a3b02,Potential Loyalist,2,2,A caixa veio totalmente deformada/estragada. Alguns produtos desencaixados. Melhorar a embalagem dos produtos. Achei o produto/material fraco
6172,67390dad606d5717688d052bce46dc70,Potential Loyalist,1,Entrega parcial,"Paguei por dois relógios, porém a empresa só enviou um dos produtos."
6207,0f6ff304911aa378e19f10b2bb990e9c,Potential Loyalist,1,ainda não entregou,simplesmente não entregaram e sequer deram alguma satisfação
6815,d60a2f23557ba7c63bd1be0c3a9df384,Potential Loyalist,1,Entrega incompleta,"Fui buscar o pedido nos correios mas só constavam 2 itens , faltou um a ser entregue"
6643,f4dda36d9787a364a3bfbee98878c253,Potential Loyalist,2,Médio,
6647,dc17e671c24856019535cfca38659329,Potential Loyalist,1,Nao entregRam o produto,Gostaria de saber se vao devolver o meu dinheiro
6676,ce225eebd16fb72c0ca9ece942ebdad1,Potential Loyalist,2,Produto errado,Não recebi o produto que eu comprei
6635,06d17cdfefd3949b0539e6d082de6d99,Potential Loyalist,1,produto falsificado,"produto falsificado, e uma mine escuta porem das duas que comprei nao funciona ....."
6463,698ff80fdd549ae2c0d48d1e2a59012f,Potential Loyalist,1,Entrega péssima,"Já comprei tem quase dois meses,ainda não chegou.. falta de respeito com o cliente..
Mas não vou julgar..quem sou eu
Precisa melhorar a comunicação..
E ainda aguardo meu pedido
"
6513,1a9c094ab33e3b3dabd3f85c372e17a7,Potential Loyalist,1,não recebimento,Até o momento não houve o recebimento do produto
6544,dfd82d0d6e3944796b43a7e549c46ac0,Potential Loyalist,2,Sombrite,Ainda não recebi meu produto
6567,25c5deca14082ccabc3abfdfcc072b6a,Potential Loyalist,2,demora na entrega,"O pedido saiu de sampa foi pra sao Gonçalo, ai foi pro nordeste depois voltou pra sao Gonçalo...enfim mais de 30 dias......."
6570,9d65f3c099ba6a3e697574f83d74e116,Potential Loyalist,2,Produto quebrado,"Recebi meu produto e está quebrado. Não consigo devolver pq o site das Américas não deixa.
Preciso de um retorno"
33550,427f7005ef94773154b340a84b7d7b28,Potential Loyalist,1,Prazo de entrega,Comprei o produto no dia 6/8 e no dia 17/8 ainda não tinha sido entregue.
33581,fd5db034f0e607b4a7e0aa4697f3935a,Potential Loyalist,1,erro na entrega,a entrega nao chegou correta completa
33584,0c62da95f3d081e39b77e596cea54deb,Potential Loyalist,1,NÃO RECOMENDO!,"Ainda não recebi o produto, e considerando a paralisação de caminhoneiros, já era pra ter sido entregue. "
33617,683714a0aa428eb05fd1dad1b3cb994f,Potential Loyalist,1,Ainda não chegou',"Até hoje, 17/05/2018 ainda não recebi o produto, não consta nem a chegada a minha cidade. O pedido foi feito em 02/04/2018"
33628,78a4bafc5da008bdc6f65b2e9780e167,Potential Loyalist,1,Produto Trocado,comprei um relógio chegou outro. quero fazer a troca!
33547,ce41a50f9ff95ef577cb759483fe9165,Potential Loyalist,1,Produto veio com defeito,"Produto veio com defeito não funciona, bem vou pedir troca, o preço não vale a dor de cabeça, fui em uma elétrica e comprei um prestasse."
33432,a5a41ed175e9ced7ee47aa1d2680b523,Potential Loyalist,1,Atraso na entrega,
33816,17aedfada2eb6febb261321ed75e6ee0,Potential Loyalist,1,Sem comentários,Sem comentários
33819,f4d5909a89b4ce6940bdc49e9cb2567b,Potential Loyalist,1,Produto não entregue,Produto não entregue e nenhuma explicação dada.
33901,4c353c56435ffa61897f3f012efd4aae,Potential Loyalist,1,Não entregaram os lençóis,Não entregaram os lençóis comprados 
33922,278a8f360787380418fe60c3d6e8ae92,Potential Loyalist,1,Modelo diferente.,comprei o cobertor e veio outro modelo.
33970,8c4840f05ac6595c7b26b76945a69bde,Potential Loyalist,1,Bom,
33810,ea8e4d814bb3d28eacedaff2a87fa0f9,Potential Loyalist,1,não recomendo,"por enquanto, não recebi minha encomenda apesar de estar indicado no rastreio que ja foi entregue."
33807,66b7b6bd73cd3b4083942859d6554041,Potential Loyalist,1,Cartucho falso,"Comprei dois cartuchos 662XL (1 preto/1 colorido) e após instalar em minha impressora HP Deskjet 2546 foi acusado na tela do computador como sendo falso, cortando todas as impressões pela metade."
33805,f530d11fbbe32732c41820751d933a36,Potential Loyalist,1,Péssima,"Não existe rastreamento da mercadoria, pois não há atualização da mesma. Quando houve foi 15 dias depois da última atualização, dizendo que, a mercadoria ainda não havia chegado na unidade SSA."
33715,3ae68a873484afec224de126a94c5974,Potential Loyalist,1,Produto não entregue,Pensei que seria entregue antes do prazo mas nenhuma coisa nenhuma outra
33778,e0c1b1f41aff706e03cd77b39835ec2e,Potential Loyalist,1,demora na entrega,demora na entrega
32996,4b14353d85bb41da9adf35e07d4dd1a4,Potential Loyalist,1,NAO RECEBIMENTO,AINDA NAO RECEBI O PRODUTO
33014,186ea6564c0bea9bfd22c78c5f37f2bd,Potential Loyalist,2,faltou 1 alicate,eu comprei 2 alicates e só chegou 1 alicate
33025,44949c1c7548b4c1ca16261e9138d9ad,Potential Loyalist,1,PRODUTO CHEGOU C AVARIAS,Até o momento ninguém retornou minha solicitação de reembolso pois a película veio quebrada !!!
33053,839c363922615cf40c8fe20a1fe505b6,Potential Loyalist,1,Ruim,O produto não é nada bom fiquei muito insatisfeita. 
32989,2c0118c17af414801e7a47b543d83625,Potential Loyalist,2,Simples,"Funciona como casinha para o meu coelho, mas é muito simples, sem acabamentos bem feitos. Parece feita de qualquer jeito, com os grampos e os parafusos por fora. Não traz instruções para montagem"
33064,37582cc8ad0aa747bda8097d37580545,Potential Loyalist,1,produto falsificado,"comprei achando que o kit de tintas fosse original como está no anúncio! no entanto, vi que fui enganado! a tampa ja estava virada para baixo, o selo foi colado, a embalagem é bem mais fina que a orig"
33072,74958a1f33dd60bc1e5f332b32f6d6c6,Potential Loyalist,1,Não recebi o produto,
32876,81bb109c9a8ce2f7668acc9fe5742ee8,Potential Loyalist,1,PRODUTO PÉSSIMO,PRODUTO JA CHEGOU COM DEFEITO NÃO FUCIONOU CONFORME MINHA NECESSIDADE DE USO. INFELIZMENTE ULTIMA COMPRA MINHA TOTALMENTE INSATISFEITO.
33106,1f25cb84d69fb0538ad7893e5e3cc34b,Potential Loyalist,1,Pedido veio incompleto ,Vieram faltando produtos e até agora ninguém respondeu meus e-mails. 
33249,d88c6d8c0caed386e83167dc6c448dc9,Potential Loyalist,1,Eu quero meu produto,"Comprei a Garrafa térmica,E um kit de toalhas de 10 toalhas,porém só chegou a Garrafa,Até agora nada Das toalhas.......quero muito um retorno por favor"
33291,151e9edb34867eaece4d6e7ae188f261,Potential Loyalist,1,providências lannister!,Vários atrasos e o produto com absurdo de atraso!! Aguardando providências da lannister.com
33308,488c70cb74d7e7d375849c12dad44deb,Potential Loyalist,1,Nao foi entregue,Gostaria de saber como fazer ? Pois não foi entregue .
33314,3de63ee92820ab2271995a05366d5955,Potential Loyalist,2,Demora na entrega ,"Eu recomendaria sim á joga devido a demora na entrega não compro mas no site , só comprarei na loja fisica.. Ainda não recebi meu produto estou muito insatisfeita com a demora. "
33214,caecf185fb75f02fa5514c6ddd989602,Potential Loyalist,1,negativa,"utilizo o site das amaericanas a muitos anos, sempre tive um bom retorno, as vezes demora,mas os produtos chegam sempre embalados. mas dessa vez não recebi, por isso a avaliação negativa."
34875,faebd6e1e9e861b140588f5e459536de,Potential Loyalist,1,Têm que melhorar,Não recebi o meu produto colágeno
34924,82d3f2203b03cb12e76507855da095d3,Potential Loyalist,2,Prazo de entrega demorado,"Sim, por ser medicamento de uso contínuo, uma demora de quase 15 dias para entrega é um absurdo, eu prefiro pagar um pouco mais caro no produto, e receber em 3 dias."
34937,b8ca1e3838f1d2dd740a03128ba1b2ae,Potential Loyalist,2,Faltou informação,Faltou informação substancial quanto às necessidades de outros aparelhos para instalação.
34945,329a1cab27467bedc6c0bb79c47948d3,Potential Loyalist,1,Produto diferente,"Olá, a descrição do produto não corresponde com o modelo recebido "
34852,937b8d4ebb303e18913ad7c7587a92e7,Potential Loyalist,1,ME ENTREGARAM APENAS 01,COMPREI DOIS ITENS ME ENTREGARAM APENAS 01 ITEM E NO MEU CARTÃO FOI LANÇADO 02 ITENS AGUARDANDO CONTATO DA LOJA.
34757,18f701ac2eb0d7cb1aa0134d9aeeceda,Potential Loyalist,1,Não recomendo,"Não existe pós venda, é impossível saber o status da compra. péssimo vendedor."
34775,684fdd89d877968793cfb9c8f7ef7874,Potential Loyalist,1,descrição do produto erra,"a descrição do produto estava errada e não consegui usar o produto ,pedi o cancelamento fazem 15 dias e ainda não obtive resposta"
34953,c5cb554215ad5b3ff18b2a97e67ac9c2,Potential Loyalist,1,avaliação de recebimento ,"O teclado sem fio veio com peça faltando o que impossibilita a conectividade com o PC e o mouse veio sujo, amarelado, com aspecto de usado. Solicitei a devolução com emissão de voucher de crédito."
35180,7b0b4da90f4fb19fe03e9c846c77c7e6,Potential Loyalist,1,Mandaram a cor errada,Não veio a cor que solicitei marquei azul e veio vermelho estou insatisfeito com o vendedor gostaria de saber qual será a solução que vcs vão me dar
35133,04f2f663f487d69ed819642a845d53e3,Potential Loyalist,1,péssimo ,"produto veio errado, fiz todo processo para fazer a troca. me deram 2 dias para me responder e nada. liguei e pediram para esperar. amanhã vence o prazo pra devolver ou trocar. vão me obrigar a ficar"
35147,83e196722e24231a97389de0f3d173c3,Potential Loyalist,1,RUIM,recebi outro produto e até agora não tive retorno para fazer a troca
35179,de992d3f66b14c35f8335cbb188669e1,Potential Loyalist,2,Não recomendaria,"É a difunda vez que tento comprar e o produto veio errado. Vendem produtos que não possuem estoque, só dor de cabeça, não recomendo."
35184,b5b399aa95d34e6b4866b7ccee226a7b,Potential Loyalist,1,cartucho não original,"a impressora identificou os 2 cartuchos como não originais, as impressões estão com desempenho inferior"
35006,c401c4e87b4980865262b5d6ce19061e,Potential Loyalist,1,diferente da compra,produto veio errado
35035,f6bd60ae86266e0e13b8fef85e760e24,Potential Loyalist,1,excelente,Profissionalismo
34238,709c286a652f0f46a1d34ad1aada2ccf,Potential Loyalist,1,ruim,"pedido efetuado e pago em 06/08/2018, e ainda não entregue"
34273,f6a4e5319e3d15bbec63585801f441ac,Potential Loyalist,2,Não Funciona,"Recebi tudo no prazo certo, mas o controle simplesmente não funciona!"
34342,76a0cd11c93798fac74516330bd7bf3a,Potential Loyalist,1,Não recebi ,Tá demorando mt
34032,453c36e61ab9d23453cf9bfb61cd9c74,Potential Loyalist,2,MAIS OU MENOS ,produto de qualidade muito ruim nao recomendaria esse produto 
